{
  "schemaVersion": 3,
  "sequence": 12,
  "generatedAt": "2026-10-12T02:19:31Z",
  "items": [
    {
      "id": "celeste64",
      "name": "Celeste 64",
      "description": "A 3D platformer inspired by classic N64 games. Play as Madeline, explore a small version of Celeste Mountain, collect strawberries, and master Celeste's signature movement.",
      "homepage": "https://portmaster.games/detail.html?name=celeste64",
      "source": "https://github.com/JanTrueno/Celeste64",
      "license": "LicenseRef-Celeste64-Mixed",
      "porter": {
        "name": "JanTrueno",
        "url": "https://portmaster.games/profile.html?porter=JanTrueno"
      },
      "redistribution": {
        "evidence": "https://github.com/EXOK/Celeste64#license",
        "notes": "Código sob MIT onde indicado; conteúdo autorizado para uso não comercial; o pacote também contém componentes FMOD sujeitos aos termos próprios."
      },
      "release": {
        "version": "1.1.1",
        "revision": 1,
        "channel": "stable",
        "publishedAt": "2026-09-04T18:16:00Z",
        "notes": "Build PortMaster aarch64 pronto para executar, baseado no fork de JanTrueno.",
        "review": {
          "status": "approved",
          "decisionId": "reviews/celeste64/2026-10-10",
          "reviewedAt": "2026-10-10T23:30:00Z",
          "reviewer": {
            "name": "FerreiraTechLab",
            "url": "https://github.com/FerreiraTechLab"
          },
          "checks": [
            "zip-layout",
            "hash",
            "launcher",
            "license",
            "manual-run"
          ]
        },
        "variants": [
          {
            "id": "aarch64-portmaster",
            "priority": 100,
            "requiredCapabilities": [],
            "compatibility": {
              "architectures": [
                "aarch64"
              ]
            },
            "requirements": {
              "readyToRun": true,
              "analogSticks": 2,
              "renderers": [],
              "runtimes": []
            },
            "download": {
              "packageFile": "celeste64-1.1.1.zip",
              "sizeBytes": 32650808,
              "sha256": "6187af641d2aa29f25c229b19b05a58a827200f88eab274deaf60474041d2faf",
              "infoHash": "c915ac63e216603f039cbdb5ff061ad0f0016109",
              "magnet": "magnet:?xt=urn:btih:c915ac63e216603f039cbdb5ff061ad0f0016109&dn=celeste64-1.1.1.zip&tr=udp%3A%2F%2Ftracker.opentrackr.org%3A1337%2Fannounce&tr=udp%3A%2F%2Fopen.stealth.si%3A80%2Fannounce&ws=https%3A%2F%2Fferreiratechlab.github.io%2FKMP-catalog%2Fpackages%2Fceleste64-1.1.1.zip&ws=https%3A%2F%2Fraw.githubusercontent.com%2FFerreiraTechLab%2FKMP-catalog%2Fmain%2Fdocs%2Fpackages%2Fceleste64-1.1.1.zip",
              "torrent": "ZDg6YW5ub3VuY2U0Mjp1ZHA6Ly90cmFja2VyLm9wZW50cmFja3Iub3JnOjEzMzcvYW5ub3VuY2UxMzphbm5vdW5jZS1saXN0bGw0Mjp1ZHA6Ly90cmFja2VyLm9wZW50cmFja3Iub3JnOjEzMzcvYW5ub3VuY2VlbDMzOnVkcDovL29wZW4uc3RlYWx0aC5zaTo4MC9hbm5vdW5jZWVlNDppbmZvZDY6bGVuZ3RoaTMyNjUwODA4ZTQ6bmFtZTE5OmNlbGVzdGU2NC0xLjEuMS56aXAxMjpwaWVjZSBsZW5ndGhpMjYyMTQ0ZTY6cGllY2VzMjUwMDpU60qH+kaa6deRu4TGf4lHO8huLbrBYftbGBCmaey7CdrgM36hRBHXAztLLTvWuloKQIrQPzkTTkMa1FVjP+fh/A85K+iuM0K0Y3Rlbr42PhVOr8/j3UyDyG7Jbz3yLZ6/dyrqPxziHD3v8Y/sbqQfNgVusFlc0LpAOs7NFttwcEasSRwvXn+p2/OHmAE2iPjNIDQnUYLVYwSLkKHLpFDPnOMxL79i4c/UFoAIRk/6d53sDMUB9RL8ZiHidgDzDG3wI/8OYX59wrFRgmbTHW+vL1ypAgGFBimGfPOuH+s/kC3ZdZP3aGmp5dYDUfYqhsZ1Lc752s2UrL4EXBNVg1TzPsPKox9io4zkicJlVTj9lCHA63ncZ6YtfspaJB6VxE1zNvVuq1RJE4xM+QT2ojbfWpiSv9rchtnBRQPV5uX0jOLqbPAKDpzEV4L6rZFwNCReS7gz6cFahOt9cAd2ZHrSu1u/IvXw3qDv15ijtZhc5xWCZVe8tCV+BQEz172Y6ePifyVUe/7fMXBaa99E6NGQJz2na90pPuP7ApJleypchtvdsQA5hVCY8sofwo75Q1JMchTg31LOLJktMfBy2SsTbJLXOUNzR7mc3VkhUOkwjGO0K8zVssxmWwcrapdZSALXMN30z/mpQ9K3xX88p8fRD6elmak+70zMeV4ASL0u8LSYZy3z4BwVIccpDyyrNf6iKnmDt36dVRGLpjC763PoGur2auOcSYXhgHKrXQRyQXLps0Qw9cDzHpqTp6EZwqKXRV+hw/PA9uD4TindLrwEGG00DiHKG/hjDAsxr2NUYEyyjO0XgIGh3YMxEkIpE6OhVfH9OpDCFaZfjTPHsqSdan+4NgmrH/X6cGvf4vxNIoC0fr6Q/9HJKdMmh7Cepzcsh58dzMYXroz6FLivy+id8e9pAqv2uV0Ufg10TRQZSy7pZv+VY8Q3/0FyT++tEE788ATCOwTpxqcicA28N13we3ElKBSkX6M1CbQ+cRRF1bNBShbspVLjccoFemU3Pon01bfSXjIF8IX0H8e3dqmmQNEAh1UxRxHbhSO9VNsE+nHF6niMyMmTyGuQgLbuYGp5Jltm9hM/Yykkz8uCT1dKmUlxqRdpPywv+9uRkaS6OYpAX19s8PLFpCScGNqIUlmj/eVWUWlOXBBbtKqAS1Mf320mmWrM+tQbBrTOwwyP1RqHork7g8PCemqLLBAPmrg7IRH80mel/VvQ+HdU6Au9Bsv81rZAtj0SqdvHMcubNSJC7A+gQ/SwNjE+masyfyG6Q+K/NzfZWMo0fNY2zEa4mDYcVnqJQakJxdjNtSMtQfsCDlVpskCitZjI2l/xA7dZSzuhcRaPkKLb0VIOKVH7uEmIQLcS8CT/9PvvGCxRBQqUGW0KC/xoXx8/pRXrfb0MDB93uqoKwos3Nr/faXRMw7blRduJifmkLoX93H6oYHkqSLy+pe80XFLMk/c8W1A07S9WqJckkCC/I5S3s8s8suWvOSCX9UUYkHgcA++Z6D3fhsjsRZMpvHo1Z5BBpawPpJ3HF3e+9hL6q//aTPBj4N8dsoabzje+xTFQO66fwaD6xARWgh48VM3xaLUVSCnZbRwkNGwjR20s1b6MfssWNfbNqOquolv9sMmMJ4PvrO4QTrsrcOapwa6MIW2JeniMGJjYkuKI6fZ4PnswlsVNJp1IeyIH2JGv+eiBkSt6EQzeLB3957yaJy1ZZ3+UWK0D8450DTN+VJKHGmjUW+ZiDRWMk2NBTMhvE5CC0t8VXlrse+gpEnEWHoAc6hWHTzcNI42tAehSohZ2l7wXJLmygHRBJ05nKt9KUvr3M0OL7hckWLcv6+WC4Cg6BMRK2AlOFTgPJvTgdwvz6wxe+eDkbQebs4vQQNV6nepxQh2xY5CVCCk2xprOC1k7GkBNJ+BH3pjQFOC1T/alw0BgVsPY6qkaHHiWG3xFP37RgQmqfrrPxFXqvn7HvqChuBfOgdjJlbxZA09jUTccI8aCBLHzBz/J5kkRSrMdQhfHOiYCDrUENwy2PKh9E+v0ean5Ir7WJRkk+Cmi7usFjuMLyIiZXhFuR58EKJY5kw+3liW/YnQifnSziNAUbJCZSjoOFBFa82G+kcRDHy/kteUsj0JgrlrTmnyYN0dBapEtd+3iFKh3N60UmCgqVcVeopO6Q129XE1ApoHlc/2nrGJcbw1781IWCUTlQfZoinhAOAzQgVNa09S6D4Fhq8MCQSK1cE0EUbIMBp+fOF7SGG2Iy8milgi6zemACtTKCxsfGE8x9rBH6YPRqtNeiTpIBvZPTTxUwE8EtsrBGxqBXFT1mnWdwT7Y2gM0D613akj2zejxk0qv/TPV5w0ovsEOS3Ul+x8GOsPYfVfj8cDcb4wLDPZN06JdCeb7PQY4biiPeM9pmVF6e2zrJ95Lw+nfBxg9Ebzx8CYMv2pz+KD1T+Nqdwror1Wtd8FzI1oUjI2Iwyx92osRkGHQ1+AbYK2S3sLwtMW56D9SDgRsxZHm7qvbR4Q3jhdtCTVgkTPwGYzI59X7exD3hbim+K6+cXQxItlzKCYQEWlR3y4ZSKjn+Y4ZwBKfPPoJ2IFJ8BH9j3eZn61ldsvEJPli6muSsDEdNleZVn4aE41g5Wf5fdgguxqzlN/GCiUZKes4lwH3/dtKuzPij5SrXRfHvDrjq+LzTx5sMuXS9bjGK9s1f+avS0+UxPi9Q5nxJjqMSxiAMYSnYP4LjzCcBdJHpPqBCz224hPxGdRZWoEE1yBPMiykSqYv5iPxl8rETnqN1v3gKg1HJ0cc3WumBJmZnvzS+VBittNZtzjkBdkndnKHYJeSsjGzA2Wm/sV4QpVDkel864kv0dd8FuXaBp34jN5mFnkwoihzXe5Of32HZyCCyNNeVAMjjriXm/nbshUh/c+QknQoziT9rHm0j55XlnoMN3F5SB40cp+bGzLd9Z+kmex1GyP9a9DuqDeG1cmshvZ+3Cky+FPJZlQviSzN/hv5X3zmk3OWSgDl/AOjaCA+XP4c8dvq767d0SfZB9JuGzRbRRQ71GJaW0TRd82RAzzFkCEurT7doStH1Hy2CsLFHk7v+ZeAYliu7c41W4WcviLM4tuGao6T/J+DUQTCPBdp0PGVkUFF6jRUf8aOv/xgT99dTmn/Oxn2AMVirnZDIJ79N44Hl+xf+MDso1Q6NrXSPco4bMXFyWgZ1vAGqZuHsenN1NIx13H8z2ggHQtR8PXihAwDMx41n4aFDSuIax5TLreINBiZQ5EFrDsd6Ba8lRLPuVIRcZAh/PZSqxgV5i7eFtEaJw4iTqujXFSv+UmsT4r1u1iNjNQvfBBGZTg6dXJsLWxpc3RsNzQ6aHR0cHM6Ly9mZXJyZWlyYXRlY2hsYWIuZ2l0aHViLmlvL0tNUC1jYXRhbG9nL3BhY2thZ2VzL2NlbGVzdGU2NC0xLjEuMS56aXAxMDA6aHR0cHM6Ly9yYXcuZ2l0aHVidXNlcmNvbnRlbnQuY29tL0ZlcnJlaXJhVGVjaExhYi9LTVAtY2F0YWxvZy9tYWluL2RvY3MvcGFja2FnZXMvY2VsZXN0ZTY0LTEuMS4xLnppcGVl"
            },
            "install": {
              "portId": "celeste64",
              "paths": [
                "Celeste64.sh",
                "celeste64/"
              ],
              "userDataPaths": [
                "celeste64/conf/"
              ]
            }
          }
        ]
      }
    },
    {
      "id": "kmp-client",
      "name": "KDownloader PM",
      "description": "Cliente oficial do KMP para descobrir, instalar, atualizar e semear ports em consoles compatíveis com PortMaster.",
      "homepage": "https://github.com/FerreiraTechLab/KMP",
      "source": "https://github.com/FerreiraTechLab/KMP/tree/main",
      "license": "LicenseRef-KMP-No-License-Declared",
      "porter": {
        "name": "FerreiraTechLab",
        "url": "https://github.com/FerreiraTechLab"
      },
      "redistribution": {
        "evidence": "https://github.com/FerreiraTechLab/KMP",
        "notes": "Pacote oficial produzido e distribuído pelo mantenedor do KMP; o repositório ainda não declara uma licença pública."
      },
      "release": {
        "version": "0.2.37",
        "revision": 37,
        "channel": "stable",
        "publishedAt": "2026-10-12T01:52:24Z",
        "notes": "Migra uma única vez a raiz persistente do catálogo para a geração 2.",
        "review": {
          "status": "approved",
          "decisionId": "reviews/kmp-client/2026-10-12-trust-migration",
          "reviewedAt": "2026-10-12T01:52:24Z",
          "reviewer": {
            "name": "FerreiraTechLab",
            "url": "https://github.com/FerreiraTechLab"
          },
          "checks": [
            "zip-layout",
            "hash",
            "launcher",
            "license",
            "manual-run"
          ]
        },
        "variants": [
          {
            "id": "aarch64-portmaster",
            "priority": 100,
            "requiredCapabilities": [],
            "compatibility": {
              "architectures": [
                "aarch64"
              ]
            },
            "requirements": {
              "readyToRun": true,
              "minimumRamMB": 128,
              "analogSticks": 0,
              "renderers": [],
              "runtimes": [
                "love_11_5"
              ]
            },
            "download": {
              "packageFile": "KMP-v0.2.37.zip",
              "sizeBytes": 9045433,
              "sha256": "869f38697b9874f0eb1369a968e4e199af189598df96d8dbecfbd3037e635579",
              "infoHash": "e3736dd93b0d0bec4e88102fe91bda9e78741bfb",
              "magnet": "magnet:?xt=urn:btih:e3736dd93b0d0bec4e88102fe91bda9e78741bfb&dn=KMP-v0.2.37.zip&tr=udp%3A%2F%2Ftracker.opentrackr.org%3A1337%2Fannounce&tr=udp%3A%2F%2Fopen.stealth.si%3A80%2Fannounce&ws=https%3A%2F%2Fferreiratechlab.github.io%2FKMP-catalog%2Fpackages%2FKMP-v0.2.37.zip&ws=https%3A%2F%2Fraw.githubusercontent.com%2FFerreiraTechLab%2FKMP-catalog%2Fmain%2Fdocs%2Fpackages%2FKMP-v0.2.37.zip",